{"schemaVersion":1,"id":"trade.tomatoes","commodity":{"id":"tomatoes","label":"Tomatoes","definition":"Tomatoes, fresh or chilled (HS 0702). Excludes processed tomatoes.","hsScope":"HS 0702","cn8":[{"code":"07020000","commodityId":7020000,"description":"Tomatoes, fresh or chilled","firstMonth":"2019-01","lastMonth":"2024-12","monthsRecorded":72,"calendarMonths":[1,2,3,4,5,6,7,8,9,10,11,12],"netMassKgByCalendarMonth":[191406514,190093022,203283470,209422094,187020357,186667947,183663042,174272065,157830513,171931864,184612535,187121055]},{"code":"07020010","commodityId":7020010,"description":"Whole tomatoes, with greatest diameter <47mm, fresh or chilled","firstMonth":"2025-01","lastMonth":"2026-08","monthsRecorded":20,"calendarMonths":[1,2,3,4,5,6,7,8,9,10,11,12],"netMassKgByCalendarMonth":[27767338,27010499,29794195,29532333,23809038,20752758,22319130,16987127,8492002,8555947,10517043,13288511]},{"code":"07020091","commodityId":7020091,"description":"Tomatoes in trusses, with greatest diameter =>47mm, fresh or chilled","firstMonth":"2025-01","lastMonth":"2026-08","monthsRecorded":20,"calendarMonths":[1,2,3,4,5,6,7,8,9,10,11,12],"netMassKgByCalendarMonth":[9142950,9260015,10978457,14341651,15886153,15579301,17598532,14368857,7084811,6816979,4733761,4580879]},{"code":"07020099","commodityId":7020099,"description":"Tomatoes, fresh or chilled (excl. in trusses, and whole tomatoes with greatest diameter <47mm)","firstMonth":"2025-01","lastMonth":"2026-08","monthsRecorded":20,"calendarMonths":[1,2,3,4,5,6,7,8,9,10,11,12],"netMassKgByCalendarMonth":[28204776,28496551,29204152,30296291,30098279,28072954,31116013,26512271,13165168,15208723,14254006,15167450]}]},"flows":[{"id":1,"label":"EU imports"},{"id":3,"label":"Non-EU imports"}],"months":{"first":"2019-01","last":"2026-08","provisionalFrom":"2025-03"},"units":{"mass":"kg","value":"GBP"},"partners":[{"key":"AL","name":"Albania","hmrcNames":["Albania"],"hmrcCountryIds":[70],"kind":"country","iso2":"AL","geometry":"polygon","point":[20.1138,40.6549]},{"key":"AT","name":"Austria","hmrcNames":["Austria"],"hmrcCountryIds":[38],"kind":"country","iso2":"AT","geometry":"polygon","point":[14.1305,47.5189]},{"key":"AU","name":"Australia","hmrcNames":["Australia"],"hmrcCountryIds":[800],"kind":"country","iso2":"AU","geometry":"polygon","point":[134.0497,-24.1295]},{"key":"BE","name":"Belgium","hmrcNames":["Belgium"],"hmrcCountryIds":[17],"kind":"country","iso2":"BE","geometry":"polygon","point":[4.8004,50.7854]},{"key":"BG","name":"Bulgaria","hmrcNames":["Bulgaria"],"hmrcCountryIds":[68],"kind":"country","iso2":"BG","geometry":"polygon","point":[25.1571,42.5088]},{"key":"CH","name":"Switzerland","hmrcNames":["Switzerland"],"hmrcCountryIds":[39],"kind":"country","iso2":"CH","geometry":"polygon","point":[7.464,46.7191]},{"key":"CL","name":"Chile","hmrcNames":["Chile"],"hmrcCountryIds":[512],"kind":"country","iso2":"CL","geometry":"polygon","point":[-72.3189,-38.1518]},{"key":"CZ","name":"Czech Republic","hmrcNames":["Czechia"],"hmrcCountryIds":[61],"kind":"country","iso2":"CZ","geometry":"polygon","point":[15.3776,49.8824]},{"key":"DE","name":"Germany","hmrcNames":["Germany"],"hmrcCountryIds":[4],"kind":"country","iso2":"DE","geometry":"polygon","point":[9.6783,50.9617]},{"key":"DK","name":"Denmark","hmrcNames":["Denmark"],"hmrcCountryIds":[8],"kind":"country","iso2":"DK","geometry":"polygon","point":[9.0182,55.967]},{"key":"EC","name":"Ecuador","hmrcNames":["Ecuador"],"hmrcCountryIds":[500],"kind":"country","iso2":"EC","geometry":"polygon","point":[-78.1884,-1.2591]},{"key":"EE","name":"Estonia","hmrcNames":["Estonia"],"hmrcCountryIds":[53],"kind":"country","iso2":"EE","geometry":"polygon","point":[25.8671,58.7249]},{"key":"EG","name":"Egypt","hmrcNames":["Egypt"],"hmrcCountryIds":[220],"kind":"country","iso2":"EG","geometry":"polygon","point":[29.4458,26.1862]},{"key":"ES","name":"Spain","hmrcNames":["Spain"],"hmrcCountryIds":[11],"kind":"country","iso2":"ES","geometry":"polygon","point":[-3.4647,40.091]},{"key":"FR","name":"France","hmrcNames":["France"],"hmrcCountryIds":[1],"kind":"country","iso2":"FR","geometry":"polygon","point":[2.5523,46.6961]},{"key":"GR","name":"Greece","hmrcNames":["Greece"],"hmrcCountryIds":[9],"kind":"country","iso2":"GR","geometry":"polygon","point":[21.7257,39.4928]},{"key":"HR","name":"Croatia","hmrcNames":["Croatia"],"hmrcCountryIds":[92],"kind":"country","iso2":"HR","geometry":"polygon","point":[16.3724,45.8058]},{"key":"HU","name":"Hungary","hmrcNames":["Hungary"],"hmrcCountryIds":[64],"kind":"country","iso2":"HU","geometry":"polygon","point":[19.4479,47.0868]},{"key":"IE","name":"Ireland","hmrcNames":["Ireland"],"hmrcCountryIds":[7],"kind":"country","iso2":"IE","geometry":"polygon","point":[-7.7986,53.0787]},{"key":"IT","name":"Italy","hmrcNames":["Italy"],"hmrcCountryIds":[5],"kind":"country","iso2":"IT","geometry":"polygon","point":[11.0769,44.7325]},{"key":"JO","name":"Jordan","hmrcNames":["Jordan"],"hmrcCountryIds":[628],"kind":"country","iso2":"JO","geometry":"polygon","point":[36.376,30.805]},{"key":"LT","name":"Lithuania","hmrcNames":["Lithuania"],"hmrcCountryIds":[55],"kind":"country","iso2":"LT","geometry":"polygon","point":[24.0899,55.1037]},{"key":"LU","name":"Luxembourg","hmrcNames":["Luxembourg"],"hmrcCountryIds":[18],"kind":"country","iso2":"LU","geometry":"polygon","point":[6.0776,49.7337]},{"key":"MA","name":"Morocco","hmrcNames":["Morocco"],"hmrcCountryIds":[204],"kind":"country","iso2":"MA","geometry":"polygon","point":[-7.1873,31.6507]},{"key":"NA","name":"Namibia","hmrcNames":["Namibia"],"hmrcCountryIds":[389],"kind":"country","iso2":"NA","geometry":"polygon","point":[17.1082,-20.5753]},{"key":"NE","name":"Niger","hmrcNames":["Niger"],"hmrcCountryIds":[240],"kind":"country","iso2":"NE","geometry":"polygon","point":[9.5044,17.4462]},{"key":"NL","name":"Netherlands","hmrcNames":["Netherlands"],"hmrcCountryIds":[3],"kind":"country","iso2":"NL","geometry":"polygon","point":[5.6114,52.4222]},{"key":"NR","name":"Nauru","hmrcNames":["Nauru"],"hmrcCountryIds":[803],"kind":"country","iso2":"NR","geometry":"point","point":[166.9326,-0.5203]},{"key":"PL","name":"Poland","hmrcNames":["Poland"],"hmrcCountryIds":[60],"kind":"country","iso2":"PL","geometry":"polygon","point":[19.4905,51.9903]},{"key":"PT","name":"Portugal","hmrcNames":["Portugal"],"hmrcCountryIds":[10],"kind":"country","iso2":"PT","geometry":"polygon","point":[-8.2718,39.6067]},{"key":"RO","name":"Romania","hmrcNames":["Romania"],"hmrcCountryIds":[66],"kind":"country","iso2":"RO","geometry":"polygon","point":[24.9726,45.7332]},{"key":"RS","name":"Serbia","hmrcNames":["Serbia"],"hmrcCountryIds":[98],"kind":"country","iso2":"RS","geometry":"polygon","point":[20.788,44.1899]},{"key":"SD","name":"Sudan","hmrcNames":["Sudan"],"hmrcCountryIds":[224],"kind":"country","iso2":"SD","geometry":"polygon","point":[29.2607,16.3307]},{"key":"SI","name":"Slovenia","hmrcNames":["Slovenia"],"hmrcCountryIds":[91],"kind":"country","iso2":"SI","geometry":"polygon","point":[14.9153,46.0608]},{"key":"SK","name":"Slovakia","hmrcNames":["Slovakia"],"hmrcCountryIds":[63],"kind":"country","iso2":"SK","geometry":"polygon","point":[19.0499,48.734]},{"key":"SN","name":"Senegal","hmrcNames":["Senegal"],"hmrcCountryIds":[248],"kind":"country","iso2":"SN","geometry":"polygon","point":[-14.7786,15.1381]},{"key":"TN","name":"Tunisia","hmrcNames":["Tunisia"],"hmrcCountryIds":[212],"kind":"country","iso2":"TN","geometry":"polygon","point":[9.0079,33.6873]},{"key":"TR","name":"Turkey","hmrcNames":["Turkey"],"hmrcCountryIds":[52],"kind":"country","iso2":"TR","geometry":"polygon","point":[34.5083,39.3454]},{"key":"TT","name":"Trinidad and Tobago","hmrcNames":["Trinidad:Tobago"],"hmrcCountryIds":[472],"kind":"country","iso2":"TT","geometry":"polygon","point":[-60.9184,10.9989]},{"key":"TW","name":"Taiwan","hmrcNames":["Taiwan"],"hmrcCountryIds":[736],"kind":"country","iso2":"TW","geometry":"polygon","point":[120.8682,23.6524]},{"key":"US","name":"United States","hmrcNames":["USA","United States"],"hmrcCountryIds":[400,902],"kind":"country","iso2":"US","geometry":"polygon","point":[-97.4826,39.5385]},{"key":"UZ","name":"Uzbekistan","hmrcNames":["Uzbekistan"],"hmrcCountryIds":[81],"kind":"country","iso2":"UZ","geometry":"polygon","point":[64.0054,41.6936]},{"key":"XK","name":"Kosovo","hmrcNames":["Kosovo"],"hmrcCountryIds":[95],"kind":"country","iso2":"XK","geometry":"polygon","point":[20.8607,42.5936]}],"rows":[[0,3,830687,1056140],[0,8,1853125,3349530],[0,12,46568,65622],[0,13,14972120,18246152],[0,14,1570043,2638551],[0,18,43507,38151],[0,19,408295,927978],[0,23,7165874,7968646],[0,26,5716630,11432664],[0,28,44959,54445],[0,29,287172,478191],[0,30,89,84],[0,35,205920,176731],[0,37,25074,31041],[1,3,621460,743576],[1,8,1945166,3405862],[1,12,46800,63832],[1,13,19557390,17087700],[1,14,1367011,2252943],[1,15,47320,52562],[1,18,23867,36093],[1,19,562200,1205977],[1,23,7422590,8076531],[1,26,5291970,10999695],[1,28,21079,27860],[1,29,223427,467065],[1,30,112,113],[1,35,187200,154928],[1,37,1950,2418],[2,3,621619,661355],[2,8,2268213,3566349],[2,12,23400,31912],[2,13,20576073,17995727],[2,14,1562259,2785281],[2,15,15470,17184],[2,18,44153,74025],[2,19,718242,1302836],[2,23,8015701,8539250],[2,26,6372549,12597220],[2,28,26606,37030],[2,29,296024,788749],[2,30,89,78],[2,35,149760,123595],[2,36,16550,15280],[3,3,639702,745679],[3,8,3153547,5499386],[3,13,18862490,13115396],[3,14,977017,1682936],[3,15,23660,26281],[3,18,33100,87481],[3,19,551488,900339],[3,21,1860,5271],[3,23,7407267,8231372],[3,26,11443074,17020723],[3,28,27615,36501],[3,29,317468,617598],[3,30,205,293],[3,35,89790,73420],[4,3,709367,728722],[4,8,1993518,3472401],[4,13,7175513,7584694],[4,14,468982,1163185],[4,15,13884,14813],[4,18,64482,127357],[4,19,468971,617738],[4,21,3840,7336],[4,23,4107214,5012372],[4,26,17889531,20370708],[4,28,109847,104997],[4,29,197190,407158],[4,30,274,217],[4,35,34575,37222],[5,3,773283,655515],[5,8,741822,1580948],[5,